{
  "schema_version": 1,
  "project": "observability-stack",
  "benchmark": {
    "metric": "incident_recovery_seconds",
    "unit": "seconds",
    "samples": [0.139692345, 0.1335875, 0.12501414],
    "median": 0.1335875
  },
  "runs": [
    {
      "incident_id": "incident-evidence-001",
      "lifecycle_statuses": [200, 503, 200],
      "detection_seconds": 0.071156679,
      "recovery_seconds": 0.139692345,
      "trace_ids": [
        "11111111111111111111111111111111",
        "22222222222222222222222222222222",
        "33333333333333333333333333333333"
      ],
      "signals": { "metrics": true, "traces": true, "logs": true }
    },
    {
      "incident_id": "incident-evidence-002",
      "lifecycle_statuses": [200, 503, 200],
      "detection_seconds": 0.071461147,
      "recovery_seconds": 0.1335875,
      "trace_ids": [
        "44444444444444444444444444444444",
        "55555555555555555555555555555555",
        "66666666666666666666666666666666"
      ],
      "signals": { "metrics": true, "traces": true, "logs": true }
    },
    {
      "incident_id": "incident-evidence-003",
      "lifecycle_statuses": [200, 503, 200],
      "detection_seconds": 0.064714477,
      "recovery_seconds": 0.12501414,
      "trace_ids": [
        "77777777777777777777777777777777",
        "88888888888888888888888888888888",
        "99999999999999999999999999999999"
      ],
      "signals": { "metrics": true, "traces": true, "logs": true }
    }
  ],
  "signal_correlation_rate": 1.0,
  "profiles": {
    "evidence": {
      "clock": "monotonic",
      "volume_strategy": "named-volume",
      "app_non_root": true,
      "collector_non_root": true,
      "benchmark_non_root": true,
      "result_copy_required": true
    },
    "exploration": {
      "backends": ["prometheus", "tempo", "loki", "grafana"],
      "health": {
        "app": true,
        "prometheus": true,
        "tempo": true,
        "loki": true,
        "grafana": true
      },
      "navigation": {
        "metric_to_trace": true,
        "trace_to_logs": true,
        "dashboard_provisioned": true
      }
    }
  },
  "provenance": {
    "source_commit": "2b289f4554d5f976f45d0126816d93490811f34d",
    "image_digest": "sha256:a28b8b6e2f27aa4ed1d06c905bf59dc1448704b834c68bfffe590fd1c52b25a6",
    "dependency_lock_digest": "sha256:65d0981433c2eb15459a97bd9fbe3bb40c5f74cfda66b646b5f95f16ca69a0e9",
    "checkout_fetch_depth": 0,
    "exact_head_ci_run_url": "https://github.com/Brilhante29/observability-stack/actions/runs/32446255631"
  }
}
